{
  "meta": {
    "title": "Style preview — synthetic fixture, not a real audit",
    "date": "2026-07-22",
    "inputType": "screenshot",
    "overall": 77,
    "grade": "B",
    "summary": "This is a fixture, not an audit. Every score, finding and quote below is invented to exercise the report template: five severity levels, all four verdicts, a scored and an unscored dimension, and one dimension in each score band. Use it to preview styling changes without re-running a real audit.",
    "assumptions": [
      "Screens are placeholders generated by fixtures/make_placeholders.py, not a real product."
    ],
    "limitations": [
      "Nothing here was measured. The numbers are chosen to land one dimension in each colour band."
    ]
  },
  "platform": {
    "screens": [
      {
        "screenId": "screen-01",
        "bucket": "mobile app (iOS)",
        "conventionSet": "HIG",
        "signals": ["placeholder geometry at 390x844", "status bar and tab bar blocks present"]
      },
      {
        "screenId": "screen-02",
        "bucket": "mobile app (iOS)",
        "conventionSet": "HIG",
        "signals": ["same frame as screen-01", "form-shaped block layout"]
      }
    ]
  },
  "dimensions": [
    { "id": "US", "name": "Usability",      "scored": true,  "weight": 0.25, "score": 83.3, "points": 2.5, "applicable": 3 },
    { "id": "VD", "name": "Visual design",  "scored": true,  "weight": 0.25, "score": 50.0, "points": 1.0, "applicable": 2 },
    { "id": "AC", "name": "Accessibility",  "scored": true,  "weight": 0.25, "score": 75.0, "points": 1.5, "applicable": 2 },
    { "id": "CO", "name": "Consistency",    "scored": false, "weight": null, "score": null, "points": null, "applicable": null },
    { "id": "UF", "name": "User flow",      "scored": true,  "weight": 0.25, "score": 100.0, "points": 2.0, "applicable": 2 }
  ],
  "scorecard": [
    {
      "criterionId": "US-01", "dimension": "US",
      "standard": "System status is visible — the screen says what state it is in",
      "source": "Nielsen, 10 Usability Heuristics (H1)",
      "verdict": "pass",
      "reasoning": "Fixture row: rendered as a pass so the green verdict dot appears in this table."
    },
    {
      "criterionId": "US-04", "dimension": "US",
      "standard": "Language matches the audience rather than the system",
      "source": "Nielsen, 10 Usability Heuristics (H2)",
      "verdict": "pass",
      "reasoning": "Fixture row."
    },
    {
      "criterionId": "US-10", "dimension": "US",
      "standard": "Icons are recognisable without labels, or are labelled",
      "source": "Nielsen, 10 Usability Heuristics (H6)",
      "verdict": "partial",
      "reasoning": "Fixture row: rendered as a partial so the orange verdict dot appears."
    },
    {
      "criterionId": "VD-02", "dimension": "VD",
      "standard": "Type scale holds a consistent ratio across levels",
      "source": "Material Design 3, Typography",
      "verdict": "pass",
      "reasoning": "Fixture row."
    },
    {
      "criterionId": "VD-05", "dimension": "VD",
      "standard": "Primary action is the most visually prominent control",
      "source": "Apple HIG, Buttons",
      "verdict": "fail",
      "reasoning": "Fixture row: rendered as a fail so the red verdict dot appears and Visual design lands in the red band."
    },
    {
      "criterionId": "AC-02", "dimension": "AC",
      "standard": "Text contrast meets 4.5:1 (3:1 for large text)",
      "source": "W3C WCAG 2.2, SC 1.4.3",
      "verdict": "pass",
      "reasoning": "Fixture row."
    },
    {
      "criterionId": "AC-06", "dimension": "AC",
      "standard": "Measured text spacing leaves room for user overrides",
      "source": "W3C WCAG 2.2, SC 1.4.12",
      "verdict": "partial",
      "reasoning": "Fixture row."
    },
    {
      "criterionId": "AC-11", "dimension": "AC",
      "standard": "Every control exposes a programmatic name, role and value",
      "source": "W3C WCAG 2.2, SC 4.1.2",
      "verdict": "na",
      "reasoning": "Not assessable from pixels.",
      "naReason": "Needs the DOM or a Figma file; a screenshot carries no accessibility tree."
    },
    {
      "criterionId": "CO-03", "dimension": "CO",
      "standard": "Colour values resolve to a shared token set",
      "source": "Material Design 3, Design tokens",
      "verdict": "na",
      "reasoning": "Not assessable from pixels.",
      "naReason": "Token checks need the source file; this fixture ships images only."
    },
    {
      "criterionId": "CO-07", "dimension": "CO",
      "standard": "Spacing steps come from one scale",
      "source": "Material Design 3, Design tokens",
      "verdict": "na",
      "reasoning": "Not assessable from pixels.",
      "naReason": "Same as CO-03 — this is what an entirely unscored dimension looks like."
    },
    {
      "criterionId": "UF-02", "dimension": "UF",
      "standard": "Each step states what happens next",
      "source": "Nielsen, 10 Usability Heuristics (H1)",
      "verdict": "pass",
      "reasoning": "Fixture row."
    },
    {
      "criterionId": "UF-09", "dimension": "UF",
      "standard": "The user can reverse a step without losing entered data",
      "source": "Nielsen, 10 Usability Heuristics (H3)",
      "verdict": "pass",
      "reasoning": "Fixture row: both UF rows pass so User flow lands at 100."
    }
  ],
  "screens": [
    { "id": "screen-01", "label": "Placeholder screen 1 — landing", "image": "screen-01.png" },
    { "id": "screen-02", "label": "Placeholder screen 2 — form", "image": "screen-02.png" }
  ],
  "findings": [
    {
      "id": 1, "screenId": "screen-01", "criterionId": "VD-05", "severity": 4,
      "title": "Critical — the highest severity, rendered in red",
      "evidence": "Fixture finding pinned to the primary-action block. Exists so the red tag, red marker and red card tint are all visible in one place.",
      "fix": "Nothing to fix — this is a fixture. Real findings name a direction and the principle it restores.",
      "source": "Apple HIG, Buttons",
      "x": 50, "y": 64.7
    },
    {
      "id": 2, "screenId": "screen-01", "criterionId": "US-10", "severity": 3,
      "title": "Major — shares the red hue with Critical",
      "evidence": "Pinned to the first content card. Major and Critical deliberately share one red: both mean fix this.",
      "fix": "Fixture placeholder.",
      "source": "Nielsen, 10 Usability Heuristics (H6)",
      "x": 50, "y": 41.7
    },
    {
      "id": 3, "screenId": "screen-01", "criterionId": "AC-06", "severity": 2,
      "title": "Minor — orange, and drawn as a region rather than a point",
      "evidence": "Carries w and h, so the template renders a dashed region box over the hero block instead of a bare marker.",
      "fix": "Fixture placeholder.",
      "source": "W3C WCAG 2.2, SC 1.4.12",
      "x": 4.1, "y": 13.3, "w": 91.8, "h": 21.3
    },
    {
      "id": 4, "screenId": "screen-02", "criterionId": "AC-02", "severity": 1,
      "title": "Cosmetic — purple",
      "evidence": "Pinned to the second form field on screen 2, so the multi-screen rendering path gets exercised too.",
      "fix": "Fixture placeholder.",
      "source": "W3C WCAG 2.2, SC 1.4.3",
      "x": 50, "y": 23.0
    },
    {
      "id": 5, "screenId": "screen-02", "criterionId": "UF-02", "severity": 0,
      "title": "Note — blue, the same hue as the watch list",
      "evidence": "Lowest severity. Blue is shared with the designer watch list because both mean no score impact.",
      "fix": "Fixture placeholder.",
      "source": "Nielsen, 10 Usability Heuristics (H1)",
      "x": 50, "y": 42.7
    }
  ],
  "advisories": [
    {
      "title": "This is what a watch-list card looks like",
      "note": "Advisories are the channel for things worth a designer's attention that should not move the score — deliberate patterns, audience-dependent calls, and judgements that need context the audit does not have.",
      "criterionId": "US-10"
    },
    {
      "title": "A second card, to check vertical rhythm",
      "note": "Two cards make it obvious whether spacing between watch-list entries matches spacing between Areas to Fix entries."
    }
  ],
  "flow": {
    "observed": [
      "screen-01 → screen-02: the primary action opens the form.",
      "screen-02 → submit: the form ends in a single submit control."
    ],
    "missing": [
      "No error state was captured for the form on screen-02.",
      "No confirmation screen follows submit."
    ],
    "suggestedNext": [
      "Capture the form's validation-error state.",
      "Capture whatever screen follows a successful submit.",
      "Capture the back path out of the form."
    ]
  }
}
